Yau Tsim Mong,Man Wai Building,,6104,"Man Wai Building, Yau Tsim Mong","22.30783,114.1672"
Yau Tsim Mong,142-146 Tung Choi Street Kai Wan Building,,6105,"142-146 Tung Choi Street Kai Wan Building, Yau Tsim Mong","22.32186,114.17021"
Kwun Tong,"Kan Wah House, Lok Wah North Estate",,6106,"Kan Wah House, Lok Wah North Estate, Kwun Tong","22.32172,114.2204"
Tai Po,Pui Kam Building,,6108,"Pui Kam Building, Tai Po","22.44688,114.16648"
Yau Tsim Mong,Chung Yuen Building,,6109,"Chung Yuen Building, Yau Tsim Mong","22.32285,114.16083"
Sham Shui Po,"Lai Tak House, Lai On Estate",,6110,"Lai Tak House, Lai On Estate, Sham Shui Po","22.33107,114.15805"
Yau Tsim Mong,703 Shanghai Street,,6111,"703 Shanghai Street, Yau Tsim Mong","22.32303,114.16716"
Kwun Tong,Hipway Towers,,6112,"Hipway Towers, Kwun Tong","22.32135,114.22614"
Kowloon City,Luen Fat Mansion,,6113,"Luen Fat Mansion, Kowloon City","22.31606,114.18808"
Kowloon City,Fullfair House,,6114,"Fullfair House, Kowloon City","22.31206,114.18712"
Eastern,"Maple Mansion, Harbour View Gardens",,6115,"Maple Mansion, Harbour View Gardens, Eastern","22.28762,114.21594"
Wan Chai,Brighton Hotel,,6116,"Brighton Hotel, Wan Chai","22.27796,114.17261"
Eastern,Yuet Ming Building,,6117,"Yuet Ming Building, Eastern","22.31431,114.22812"
Yuen Long,"Tong Fong Tsuen, Ping Shan",,6118,"Tong Fong Tsuen, Ping Shan, Yuen Long","22.44369,114.00731"
Kwai Tsing,"Kwai Ming House, Kwai Fong Estate",,6119,"Kwai Ming House, Kwai Fong Estate, Kwai Tsing","22.35838,114.12957"
Sha Tin,"Yiu Yan House, Yiu On Estate",,6120,"Yiu Yan House, Yiu On Estate, Sha Tin","22.42074,114.23137"
Yuen Long,"Block 17, Sereno Verde",,6121,"Block 17, Sereno Verde, Yuen Long","22.43692,114.03116"
Wong Tai Sin,Aspen Crest,,6122,"Aspen Crest, Wong Tai Sin","22.34504,114.19858"
Kwai Tsing,"On Tao House, Cheung On Estate",,6123,"On Tao House, Cheung On Estate, Kwai Tsing","22.36062,114.10208"
Yuen Long,"Block 8, Phase 2, Central Park Towers",,6124,"Block 8, Phase 2, Central Park Towers, Yuen Long","22.45966,114.00144"
Sham Shui Po,"Stage 5, Mei Foo Sun Chuen",,6125,"Stage 5, Mei Foo Sun Chuen, Sham Shui Po","22.33958,114.13967"
Kowloon City,"Tower 5, Sky Tower",,6131,"Tower 5, Sky Tower, Kowloon City","22.32307,114.19042"
Wong Tai Sin,"Chu Fung House, Fung Tak Estate",,6132,"Chu Fung House, Fung Tak Estate, Wong Tai Sin","22.34547,114.20067"
Southern,"Block 9, Yee Ngar Court, South Horizons",,6133,"Block 9, Yee Ngar Court, South Horizons, Southern","22.24409,114.14477"
Kowloon City,"Block 7, Phase 12, Bamboo Mansions, Whampoa Garden",,6134,"Block 7, Phase 12, Bamboo Mansions, Whampoa Garden, Kowloon City","22.30588,114.19112"
Kwai Tsing,"Block 8, Kwai Shing West Estate",,6135,"Block 8, Kwai Shing West Estate, Kwai Tsing","22.36072,114.12149"
Central & Western,"Block B, Phase 3, Kwan Yick Building",,6136,"Block B, Phase 3, Kwan Yick Building, Central & Western","22.28826,114.14058"
Kwai Tsing,"Block 6, Villa Esplanada",,6137,"Block 6, Villa Esplanada, Kwai Tsing","22.36265,114.10659"
Kwun Tong,"Block 4, Richland Gardens",,6138,"Block 4, Richland Gardens, Kwun Tong","22.32998,114.20629"
Southern,"Wah Sang House, Wah Fu Estate",,6139,"Wah Sang House, Wah Fu Estate, Southern","22.25249,114.13639"
Yuen Long,"Block 14, Full Silver Garden",,6140,"Block 14, Full Silver Garden, Yuen Long","22.42501,114.07439"
Yuen Long,"Block 14, Full Silver Garden",,6141,"Block 14, Full Silver Garden, Yuen Long","22.42501,114.07439"
Yuen Long,"Block 14, Full Silver Garden",,6142,"Block 14, Full Silver Garden, Yuen Long","22.42501,114.07439"
Tuen Mun,"High Block, Oi Chi House, Yau Oi Estate",,6143,"High Block, Oi Chi House, Yau Oi Estate, Tuen Mun","22.387,113.97413"
Eastern,11 Ming Yuen Western Street,,6144,"11 Ming Yuen Western Street, Eastern","22.29016,114.19901"
Wan Chai,"Block A, Pearl City Mansion",,6146,"Block A, Pearl City Mansion, Wan Chai","22.28099,114.18586"
Wan Chai,"Block A, Pearl City Mansion",,6147,"Block A, Pearl City Mansion, Wan Chai","22.28099,114.18586"
Southern,61 Tung Tau Wan Road,,6148,"61 Tung Tau Wan Road, Southern","22.21467,114.21829"
Sai Kung,Kambridge Garden,,6149,"Kambridge Garden, Sai Kung","22.33984,114.24794"
Central & Western,"Tower 2, Robinson Place",,6150,"Tower 2, Robinson Place, Central & Western","22.28148,114.14948"
North,"Fu Ming House, Wah Ming Estate",,6151,"Fu Ming House, Wah Ming Estate, North","22.4828,114.14004"
Sha Tin,"Block 3, Ma On Shan Centre",,6152,"Block 3, Ma On Shan Centre, Sha Tin","22.42615,114.23308"
Wong Tai Sin,Shung Ling Building,,6153,"Shung Ling Building, Wong Tai Sin","22.3346,114.19583"
Wong Tai Sin,"Tower 2, Grand View Garden",,6154,"Tower 2, Grand View Garden, Wong Tai Sin","22.34161,114.20777"
Kwun Tong,"Shing Tat House, On Tat Estate",,6156,"Shing Tat House, On Tat Estate, Kwun Tong","22.32145,114.23394"
Kwun Tong,"Yee Hong House, Hong Wah Court",,6157,"Yee Hong House, Hong Wah Court, Kwun Tong","22.31413,114.24032"
Kowloon City,"Block 5, Harbour Place",,6158,"Block 5, Harbour Place, Kowloon City","22.30334,114.18623"
Eastern,"Block 2, City Garden",,6159,"Block 2, City Garden, Eastern","22.29092,114.19473"
Sai Kung,"Tower 3, Metro Town",,6160,"Tower 3, Metro Town, Sai Kung","22.30432,114.25217"
Tsuen Wan,"Block 3, Bo Shek Mansion",,6161,"Block 3, Bo Shek Mansion, Tsuen Wan","22.36838,114.11776"
Islands,"Block 22, Siena Two, Discovery Bay",,6162,"Block 22, Siena Two, Discovery Bay, Islands","22.30906,114.01694"
Sha Tin,"Tower 9, Woodcrest Hill",,6163,"Tower 9, Woodcrest Hill, Sha Tin","22.36817,114.16935"
Wan Chai,Hung Fook Mansion,,6164,"Hung Fook Mansion, Wan Chai","22.27906,114.17914"
North,"Ching Ping House, Ching Ho Estate",,6165,"Ching Ping House, Ching Ho Estate, North","22.49362,114.12577"
Central & Western,Woodland Court,,6166,"Woodland Court, Central & Western","22.28177,114.15053"
Kwun Tong,Oi Tai Building,,6166,"Oi Tai Building, Kwun Tong","22.39563,113.9769"
Eastern,"Wan Poon House, Chai Wan Estate",,6167,"Wan Poon House, Chai Wan Estate, Eastern","22.26413,114.24208"
Kwun Tong,"Sau Lok House, Sau Mau Ping Estate",,6168,"Sau Lok House, Sau Mau Ping Estate, Kwun Tong","22.32131,114.23147"
Yau Tsim Mong,Kai Wan Building,,6169,"Kai Wan Building, Yau Tsim Mong","22.31911,114.16699"
Southern,"Tower 11, Yee Fung Court, South Horizons",,6170,"Tower 11, Yee Fung Court, South Horizons, Southern","22.24433,114.14577"
Sai Kung,"Moonlight, Phase 2A, Le Prestige, LOHAS Park",,6171,"Moonlight, Phase 2A, Le Prestige, LOHAS Park, Sai Kung","22.29447,114.27304"
Southern,"Fu Wing Yuen, Chi Fu Fa Yuen",,6172,"Fu Wing Yuen, Chi Fu Fa Yuen, Southern","22.25871,114.13715"
Kwun Tong,"Lei Sang House , Lei Yue Mun Estate",,6173,"Lei Sang House , Lei Yue Mun Estate, Kwun Tong","22.29458,114.24054"
Wong Tai Sin,"Tower 1, Aria",,6174,"Tower 1, Aria, Wong Tai Sin","22.33973,114.21337"
Sha Tin,"Fontana Heights, Belair Gardens",,6175,"Fontana Heights, Belair Gardens, Sha Tin","22.38451,114.19925"
Yuen Long,"Block 1, Phase 6, Maywood Court",,6176,"Block 1, Phase 6, Maywood Court, Yuen Long","22.4613,114.00629"
Sham Shui Po,Galloway Mansion,,6177,"Galloway Mansion, Sham Shui Po","22.32674,114.1671"
Kowloon City,"King Man House, Ho Man Tin Estate",,6178,"King Man House, Ho Man Tin Estate, Kowloon City","22.3182,114.18104"
Wong Tai Sin,"Luk Ching House, Choi Hung Estate",,6179,"Luk Ching House, Choi Hung Estate, Wong Tai Sin","22.33425,114.2064"
Islands,"Block 34, Coastline Villa, Discovery Bay",,6180,"Block 34, Coastline Villa, Discovery Bay, Islands","22.2945,114.02601"
Tsuen Wan,"Block 3, Bo Shek Mansion",,6181,"Block 3, Bo Shek Mansion, Tsuen Wan","22.36838,114.11776"
Yuen Long,Mong Tseng Tsuen,,6182,"Mong Tseng Tsuen, Yuen Long","22.47753,114.00131"
Tsuen Wan,"Block 3, Bo Shek Mansion",,6183,"Block 3, Bo Shek Mansion, Tsuen Wan","22.36838,114.11776"
Tsuen Wan,"Tower 3, Vision City",,6184,"Tower 3, Vision City, Tsuen Wan","22.37036,114.11369"
Sham Shui Po,"Tower 1, The Pacifica",,6185,"Tower 1, The Pacifica, Sham Shui Po","22.33536,114.14949"
Eastern,"Tung Chi House, Tung Yuk Court",,6186,"Tung Chi House, Tung Yuk Court, Eastern","22.2825,114.22735"
Central & Western,"Block B, Phase 3, Kwan Yick Building",,6187,"Block B, Phase 3, Kwan Yick Building, Central & Western","22.28826,114.14058"
Wan Chai,Harmony Court,,6188,"Harmony Court, Wan Chai","22.27682,114.19319"
North,"Tower 1, Noble Hill",,6189,"Tower 1, Noble Hill, North","22.50358,114.13458"
Kwai Tsing,"Kai King Lau, Cho Yiu Chuen",,6190,"Kai King Lau, Cho Yiu Chuen, Kwai Tsing","22.34679,114.12885"
Central & Western,"Block B, Phase 3, Kwan Yick Building",,6191,"Block B, Phase 3, Kwan Yick Building, Central & Western","22.28826,114.14058"
Kowloon City,"Tower 1, Oasis Kai Tak",,6192,"Tower 1, Oasis Kai Tak, Kowloon City","22.32905,114.19945"
Sham Shui Po,"Nam On House, Nam Shan Estate",,6193,"Nam On House, Nam Shan Estate, Sham Shui Po","22.33363,114.1713"
Sha Tin,"Tower 3, The Palazzo",,6194,"Tower 3, The Palazzo, Sha Tin","22.39456,114.19914"
Eastern,Hung Yat Building,,6196,"Hung Yat Building, Eastern","22.29098,114.19643"
Sha Tin,"Hoi Ning Building, Shatin Centre",,6197,"Hoi Ning Building, Shatin Centre, Sha Tin","22.38205,114.19065"
Kwai Tsing,"Wang Ngai House, Cheung Wang Estate",,6198,"Wang Ngai House, Cheung Wang Estate, Kwai Tsing","22.35668,114.09621"
Sha Tin,"Ka Wai House, Ka Tin Court",,6199,"Ka Wai House, Ka Tin Court, Sha Tin","22.36066,114.17288"
Kowloon City,"Block 5, Willow Mansions, Phase 3, Whampoa Garden",,6200,"Block 5, Willow Mansions, Phase 3, Whampoa Garden, Kowloon City","22.30476,114.18658"
Kowloon City,"Kadoorie Hill, 211 Prince Edward Road West",,6201,"Kadoorie Hill, 211 Prince Edward Road West, Kowloon City","22.32487,114.17546"
Wong Tai Sin,"Nga Yuen House, Chuk Yuen South Estate",,6202,"Nga Yuen House, Chuk Yuen South Estate, Wong Tai Sin","22.34472,114.19466"
Yau Tsim Mong,Ka Fat Building,,6203,"Ka Fat Building, Yau Tsim Mong","22.29473,114.23832"
Yau Tsim Mong,Eliza Building,,6204,"Eliza Building, Yau Tsim Mong","22.32353,114.17066"
Sai Kung,"Tak Fu House, Hau Tak Estate",,6205,"Tak Fu House, Hau Tak Estate, Sai Kung","22.31876,114.26425"
Tuen Mun,"Block 8, Po Tin Estate",,6206,"Block 8, Po Tin Estate, Tuen Mun","22.41074,113.96689"
Wan Chai,"Block B, Villa Rocha",,6207,"Block B, Villa Rocha, Wan Chai","22.27248,114.18628"
Eastern,Yuet Ming Building,,6208,"Yuet Ming Building, Eastern","22.31431,114.22812"
Wan Chai,Park Garden,,6209,"Park Garden, Wan Chai","22.27333,114.19297"
Wan Chai,Park Garden,,6210,"Park Garden, Wan Chai","22.27333,114.19297"
Wan Chai,Tsing Fung Building,,6211,"Tsing Fung Building, Wan Chai","22.28461,114.19222"
North,"Choi Lai House, Choi Yuen Estate",,6212,"Choi Lai House, Choi Yuen Estate, North","22.50004,114.12541"
Sha Tin,"Sheung Sam House, Lung Hang Estate",,6213,"Sheung Sam House, Lung Hang Estate, Sha Tin","22.36532,114.17833"
Sha Tin,"Block 7, Royal Ascot",,6214,"Block 7, Royal Ascot, Sha Tin","22.39941,114.20186"
Sai Kung,"Tower 2, Hemera, Phase 3, LOHAS Park",,6215,"Tower 2, Hemera, Phase 3, LOHAS Park, Sai Kung","22.29682,114.26984"
Eastern,"Tower 3, Grand Promenade",,6216,"Tower 3, Grand Promenade, Eastern","22.28547,114.2246"
Eastern,"Tower 3, Grand Promenade",,6217,"Tower 3, Grand Promenade, Eastern","22.28547,114.2246"
Sha Tin,"Yiu Him House, Yiu On Estate",,6218,"Yiu Him House, Yiu On Estate, Sha Tin","22.41851,114.23074"
Sha Tin,Shatin Knoll,,6219,"Shatin Knoll, Sha Tin","22.40897,114.20819"
Sai Kung,"Tower 6, Le Point, Metro Town",,6220,"Tower 6, Le Point, Metro Town, Sai Kung","22.30429,114.2514"
Yau Tsim Mong,100-102 Portland Street,,6221,"100-102 Portland Street, Yau Tsim Mong","22.31472,114.1698"
Sai Kung,"Tower 2, Hemera, Phase 3, LOHAS Park",,6222,"Tower 2, Hemera, Phase 3, LOHAS Park, Sai Kung","22.29682,114.26984"
Tai Po,Mei Shing Building,,6223,"Mei Shing Building, Tai Po","22.44923,114.16371"
North,"Tin Hor House, Tin Ping Estate",,6224,"Tin Hor House, Tin Ping Estate, North","22.50341,114.13231"
Tai Po,Mei Sun Building,,6225,"Mei Sun Building, Tai Po","22.45367,114.16498"
Kwai Tsing,"Lai Lam House, Lai Yan Court",,6226,"Lai Lam House, Lai Yan Court, Kwai Tsing","22.34336,114.13687"
Yau Tsim Mong,Wah Mei Building,,6227,"Wah Mei Building, Yau Tsim Mong","22.32175,114.17079"
North,"Ching Ping House, Ching Ho Estate",,6228,"Ching Ping House, Ching Ho Estate, North","22.49362,114.12577"
Yau Tsim Mong,Po Ling Building,,6229,"Po Ling Building, Yau Tsim Mong","22.31871,114.17087"
Kwun Tong,"Lei Ye House, Lei Yue Mun Estate",,6230,"Lei Ye House, Lei Yue Mun Estate, Kwun Tong","22.29411,114.24043"
Tsuen Wan,The Panorama,,6231,"The Panorama, Tsuen Wan","22.37343,114.10296"
Kwun Tong,"Block 29, Phase 2, Laguna City",,6232,"Block 29, Phase 2, Laguna City, Kwun Tong","22.30759,114.22792"
Eastern,Wai Lee Building,,6233,"Wai Lee Building, Eastern","22.28728,114.14467"
Kowloon City,"Tower 2, One Beacon Hill",,6234,"Tower 2, One Beacon Hill, Kowloon City","22.34105,114.17602"
Sham Shui Po,"Hoi Chi House, Hoi Lai Estate",,6235,"Hoi Chi House, Hoi Lai Estate, Sham Shui Po","22.33136,114.14694"
Tai Po,Po Sam Pai Tsuen,,6236,"Po Sam Pai Tsuen, Tai Po","22.47104,114.21021"
Eastern,"Tower 1, Harbour Glory",,6237,"Tower 1, Harbour Glory, Eastern","22.28913,114.19241"
Tsuen Wan,"Block 2, Phase 1, Belvedere Garden",,6238,"Block 2, Phase 1, Belvedere Garden, Tsuen Wan","22.37289,114.10224"
Central & Western,Woodland Court,,6239,"Woodland Court, Central & Western","22.28177,114.15053"
Central & Western,"Block C, Fulham Garden",,6246,"Block C, Fulham Garden, Central & Western","22.27946,114.13156"
Sham Shui Po,"Ning Ching House, Yee Ching Court",,6247,"Ning Ching House, Yee Ching Court, Sham Shui Po","22.33249,114.15933"
Sha Tin,"Tower 2, Sausalito",,6248,"Tower 2, Sausalito, Sha Tin","22.41234,114.22233"
Kowloon City,"Block 1B, Vibe Centro",,6249,"Block 1B, Vibe Centro, Kowloon City","22.32761,114.2009"
Central & Western,Kennedy Heights,,6250,"Kennedy Heights, Central & Western","22.27621,114.15735"
Central & Western,Chiu Kwong Mansion,,6251,"Chiu Kwong Mansion, Central & Western","22.28705,114.13974"
Sha Tin,"Hing On House, Sui Wo Court",,6252,"Hing On House, Sui Wo Court, Sha Tin","22.39093,114.19339"
Sha Tin,"Tower 3, Sausalito",,6253,"Tower 3, Sausalito, Sha Tin","22.41158,114.22246"
Yau Tsim Mong,Lee Kwan Building,,6254,"Lee Kwan Building, Yau Tsim Mong","22.31935,114.17075"
Southern,"Block 9, Yee Ngar Court, South Horizons",,6255,"Block 9, Yee Ngar Court, South Horizons, Southern","22.24409,114.14477"
Kwai Tsing,"Block 8, Kwai Shing West Estate",,6256,"Block 8, Kwai Shing West Estate, Kwai Tsing","22.36072,114.12149"
Tuen Mun,"Tip Yee House, Butterfly Estate",,6257,"Tip Yee House, Butterfly Estate, Tuen Mun","22.37547,113.96387"
Southern,"Tower 9, Yee Ngar Court, South Horizons",,6258,"Tower 9, Yee Ngar Court, South Horizons, Southern","22.24409,114.14477"
Central & Western,"Block B, Phase III, Kwan Yick Building",,6259,"Block B, Phase III, Kwan Yick Building, Central & Western","22.28826,114.14058"
Yuen Long,"Block M7, Yoho Midtown",,6260,"Block M7, Yoho Midtown, Yuen Long","22.44353,114.03733"
Yuen Long,"Block M7, Yoho Midtown",,6261,"Block M7, Yoho Midtown, Yuen Long","22.44353,114.03733"
Yau Tsim Mong,Kwong Yu Building,,6262,"Kwong Yu Building, Yau Tsim Mong","22.31655,114.16695"
Sha Tin,"Block 7, Jubilee Garden",,6263,"Block 7, Jubilee Garden, Sha Tin","22.39831,114.20068"
Kwai Tsing,"On Hoi House, Cheung On Estate",,6264,"On Hoi House, Cheung On Estate, Kwai Tsing","22.36161,114.10041"
Kwun Tong,"Wing Mei House, Yau Chui Court",,6265,"Wing Mei House, Yau Chui Court, Kwun Tong","22.29974,114.23828"
Tai Po,"Tower 1, Mont Vert",,6266,"Tower 1, Mont Vert, Tai Po","22.46401,114.17957"
Kwai Tsing,"Block 6, Villa Esplanada",,6267,"Block 6, Villa Esplanada, Kwai Tsing","22.36265,114.10659"
Sha Tin,"Hin Kwai House, Hing Keng Estate",,6268,"Hin Kwai House, Hing Keng Estate, Sha Tin","22.36091,114.17146"
Wong Tai Sin,"Block 6, Grand View Garden",,6270,"Block 6, Grand View Garden, Wong Tai Sin","22.34094,114.20682"
Tsuen Wan,Tak Tai Building,,6271,"Tak Tai Building, Tsuen Wan","22.36905,114.12309"
Central & Western,Woodland Court,,6273,"Woodland Court, Central & Western","22.28177,114.15053"
Kowloon City,"King Man House, Ho Man Tin Estate",,6274,"King Man House, Ho Man Tin Estate, Kowloon City","22.3182,114.18104"
Kwun Tong,"Tak Shan House, Tak Long Estate",,6275,"Tak Shan House, Tak Long Estate, Kwun Tong","22.3299,114.20413"
Wong Tai Sin,"Block 6, Rhythm Garden",,6276,"Block 6, Rhythm Garden, Wong Tai Sin","22.33576,114.20291"
Kwun Tong,"Tak Shan House, Tak Long Estate",,6277,"Tak Shan House, Tak Long Estate, Kwun Tong","22.3299,114.20413"
Yau Tsim Mong,Chung Ying Building,,6278,"Chung Ying Building, Yau Tsim Mong","22.32303,114.16142"
Islands,"Starview, Discovery Bay",,6279,"Starview, Discovery Bay, Islands","22.30212,114.01146"
Sai Kung,"Tak Fu House, Hau Tak Estate",,6280,"Tak Fu House, Hau Tak Estate, Sai Kung","22.31876,114.26425"
Sai Kung,"Tak Fu House, Hau Tak Estate",,6281,"Tak Fu House, Hau Tak Estate, Sai Kung","22.31876,114.26425"
Sai Kung,"Ming Kok House, Ming Tak Estate",,6282,"Ming Kok House, Ming Tak Estate, Sai Kung","22.31611,114.26904"
Southern,"Mei Ka Court, South Horizons",,6283,"Mei Ka Court, South Horizons, Southern","22.24216,114.14897"
Sham Shui Po,"Mei Shan House, Shek Kip Mei Estate",,6284,"Mei Shan House, Shek Kip Mei Estate, Sham Shui Po","22.33272,114.16534"
Kwun Tong,"Tower 2, Lotus Tower, Kwun Tong Garden Estate",,6285,"Tower 2, Lotus Tower, Kwun Tong Garden Estate, Kwun Tong","22.31569,114.21995"
Southern,"Yee Ngar Court, South Horizons",,6286,"Yee Ngar Court, South Horizons, Southern","22.24409,114.14477"
Tsuen Wan,"Tower 10, Ocean Pride",,6287,"Tower 10, Ocean Pride, Tsuen Wan","22.36765,114.11014"
Eastern,Tung Wah Group of Hospitals Fong Shu Chuen Social Services Building,,6289,"Tung Wah Group of Hospitals Fong Shu Chuen Social Services Building, Eastern","22.27835,114.22915"
Wan Chai,Winfield Gardens,,6290,"Winfield Gardens, Wan Chai","22.26658,114.185"
Tsuen Wan,"Block 5, Phase 2, Belvedere Garden",,6291,"Block 5, Phase 2, Belvedere Garden, Tsuen Wan","22.37141,114.0995"
Yuen Long,"Tower 5, The Spectra",,6292,"Tower 5, The Spectra, Yuen Long","22.44899,114.02682"
North,"Block 1, Royal Green",,6293,"Block 1, Royal Green, North","22.495,114.12719"
Central & Western,"Block A, La Hacienda",,6294,"Block A, La Hacienda, Central & Western","22.26081,114.15016"
Tuen Mun,"Tower 3, Goodview Garden",,6295,"Tower 3, Goodview Garden, Tuen Mun","22.38449,113.97311"
Kwun Tong,"Hiu Sing House, Hiu Lai Court",,6296,"Hiu Sing House, Hiu Lai Court, Kwun Tong","22.3214,114.22835"
Tuen Mun,Tuen Mun Court,,6297,"Tuen Mun Court, Tuen Mun","22.37811,113.98528"
Sha Tin,"Block 5, Grandeur Garden",,6298,"Block 5, Grandeur Garden, Sha Tin","22.37411,114.17757"
Sha Tin,"Kam Wai House, Kam Fung Court",,6299,"Kam Wai House, Kam Fung Court, Sha Tin","22.42366,114.22568"
Wong Tai Sin,"Kai Fai House, Choi Wan (2) Estate",,6300,"Kai Fai House, Choi Wan (2) Estate, Wong Tai Sin","22.33341,114.21741"
Eastern,"Tung Chi House, Tung Yuk Court",,6301,"Tung Chi House, Tung Yuk Court, Eastern","22.2825,114.22735"
Eastern,"Tung Chi House, Tung Yuk Court",,6302,"Tung Chi House, Tung Yuk Court, Eastern","22.2825,114.22735"
Kowloon City,Tung Po Building,,6303,"Tung Po Building, Kowloon City","22.32121,114.19015"
Wan Chai,"Block B, Bay View Mansion",,6304,"Block B, Bay View Mansion, Wan Chai","22.27961,114.18871"
Sai Kung,"Tower 15, Ocean Shores",,6305,"Tower 15, Ocean Shores, Sai Kung","22.30322,114.25224"
Kwun Tong,"Kai Wong House, Kai Tin Estate",,6306,"Kai Wong House, Kai Tin Estate, Kwun Tong","22.30954,114.23488"
Kwun Tong,"Lam Fai House, Lam Tin Estate",,6307,"Lam Fai House, Lam Tin Estate, Kwun Tong","22.31176,114.23673"
Tai Po,"Heng Tai House, Fu Heng Estate",,6308,"Heng Tai House, Fu Heng Estate, Tai Po","22.45709,114.17104"
Yuen Long,"Yuk Ping House, Long Ping Estate",,6310,"Yuk Ping House, Long Ping Estate, Yuen Long","22.44977,114.02347"
Tuen Mun,"Siu Hang House, Siu Hong Court",,6311,"Siu Hang House, Siu Hong Court, Tuen Mun","22.41263,113.9769"
Wong Tai Sin,"Block 5, Kingsford Terrace",,6313,"Block 5, Kingsford Terrace, Wong Tai Sin","22.34,114.2113"
Kwun Tong,"Tak Cheung House, Tak Long Estate",,6314,"Tak Cheung House, Tak Long Estate, Kwun Tong","22.32944,114.20331"
Eastern,"Block 5, Aldrich Garden",,6315,"Block 5, Aldrich Garden, Eastern","22.28101,114.22902"
Tsuen Wan,"Block 1, Greenview Terrace",,6316,"Block 1, Greenview Terrace, Tsuen Wan","22.36882,114.09608"
Kwai Tsing,"Seung Lai House, Wah Lai Estate",,6317,"Seung Lai House, Wah Lai Estate, Kwai Tsing","22.34226,114.13757"
Yau Tsim Mong,"Tower 5, Central Park",,6318,"Tower 5, Central Park, Yau Tsim Mong","22.31733,114.16315"
Wong Tai Sin,"Tsz Lok Estate, Lok Tin House",,6319,"Tsz Lok Estate, Lok Tin House, Wong Tai Sin","22.3492,114.19776"
Wong Tai Sin,"Tower 2, Grand View Garden",,6320,"Tower 2, Grand View Garden, Wong Tai Sin","22.34161,114.20777"
Kwun Tong,"Yat Lai House, Yau Lai Estate",,6321,"Yat Lai House, Yau Lai Estate, Kwun Tong","22.30127,114.23622"
Yau Tsim Mong,"Sky Tower, The Arch",,6322,"Sky Tower, The Arch, Yau Tsim Mong","22.3031,114.16268"
Sham Shui Po,Fu Shun Building,,6322,"Fu Shun Building, Sham Shui Po","22.33758,114.15812"
Eastern,Winner Mansion,,6323,"Winner Mansion, Eastern","22.27773,114.22752"
Southern,"Yee Ngar Court, South Horizons",,6324,"Yee Ngar Court, South Horizons, Southern","22.24409,114.14477"
Central & Western,"Block B, Phase 3, Kwan Yick Building",,6325,"Block B, Phase 3, Kwan Yick Building, Central & Western","22.28826,114.14058"
Kowloon City,"Block 4, Palm Mansions, Whampoa Garden",,6326,"Block 4, Palm Mansions, Whampoa Garden, Kowloon City","22.30366,114.18821"
Kowloon City,"Block 7, Bamboo Mansions, Whampoa Garden",,6327,"Block 7, Bamboo Mansions, Whampoa Garden, Kowloon City","22.30588,114.19112"
Yau Tsim Mong,"Sky Tower, The Arch",,6331,"Sky Tower, The Arch, Yau Tsim Mong","22.3031,114.16268"
Yau Tsim Mong,"Sky Tower, The Arch",,6332,"Sky Tower, The Arch, Yau Tsim Mong","22.3031,114.16268"
Sai Kung,"Tower 4, The Metropolis, Metro City",,6333,"Tower 4, The Metropolis, Metro City, Sai Kung","22.32192,114.25687"
Wong Tai Sin,"Block 2, Bel Air Heights",,6334,"Block 2, Bel Air Heights, Wong Tai Sin","22.34196,114.20179"
Kowloon City,"Lok Chee Lau, Lok Man Sun Chuen",,6335,"Lok Chee Lau, Lok Man Sun Chuen, Kowloon City","22.31524,114.18641"
Islands,Hong Kong SkyCity Marriott Hotel,,6338,"Hong Kong SkyCity Marriott Hotel, Islands","22.31894,113.94361"
Islands,"Mun Hong House, Mun Tung Estate",,6339,"Mun Hong House, Mun Tung Estate, Islands","22.27612,113.93266"
Eastern,"Block B, Perfect Mount Gardens",,6341,"Block B, Perfect Mount Gardens, Eastern","22.27879,114.22886"
Wong Tai Sin,Pak Lok Nursing Home Company Limited,,6342,"Pak Lok Nursing Home Company Limited, Wong Tai Sin","22.38505,113.97566"
Kowloon City,Billion Court,,6343,"Billion Court, Kowloon City","22.30665,114.18666"
Wan Chai,"Block A, Tonnochy Towers",,6344,"Block A, Tonnochy Towers, Wan Chai","22.27915,114.17753"
Wan Chai,Kin Lee Building,,6345,"Kin Lee Building, Wan Chai","22.2786,114.17357"
Kwun Tong,"Tak Lung House, Tak Tin Estate",,6346,"Tak Lung House, Tak Tin Estate, Kwun Tong","22.30688,114.23808"
Eastern,Tung Wah Group Of Hospitals Fong Shu Chuen Day Activity Centre cum Hostel,,6347,"Tung Wah Group Of Hospitals Fong Shu Chuen Day Activity Centre cum Hostel, Eastern","22.36166,114.1018"
Kwun Tong,"Bauhinia Court, Fulrich Garden",,6348,"Bauhinia Court, Fulrich Garden, Kwun Tong","22.31626,114.22168"
Tai Po,"Shin Nga House, Fu Shin Estate",,6349,"Shin Nga House, Fu Shin Estate, Tai Po","22.4539,114.17566"
Yau Tsim Mong,26 Kimberley Road,,6350,"26 Kimberley Road, Yau Tsim Mong","22.30045,114.17346"
Kwun Tong,"Hang On House, Wo Lok Estate",,6351,"Hang On House, Wo Lok Estate, Kwun Tong","22.31489,114.22841"
Kwun Tong,"Tsui Yue House, Tsui Ping (North) Estate",,6354,"Tsui Yue House, Tsui Ping (North) Estate, Kwun Tong","22.31554,114.2291"
Kwun Tong,"Yung Lai House, Yau Lai Estate",,6355,"Yung Lai House, Yau Lai Estate, Kwun Tong","22.30055,114.2348"
Sham Shui Po,"Begonia House, So Uk Estate",,6356,"Begonia House, So Uk Estate, Sham Shui Po","22.34,114.15729"
Tai Po,Lam Tsuen San Tsuen,,6357,"Lam Tsuen San Tsuen, Tai Po","22.44981,114.13858"
Kwun Tong,"Kui Tai House, On Tai Estate",,6358,"Kui Tai House, On Tai Estate, Kwun Tong","22.3279,114.22864"
Kwun Tong,"Block 31, Laguna City",,6359,"Block 31, Laguna City, Kwun Tong","22.30558,114.22929"
Kowloon City,"Tower 2, Harbourfront Landmark",,6360,"Tower 2, Harbourfront Landmark, Kowloon City","22.30342,114.19261"
Kwai Tsing,"Wah Chi Court, Wah Yuen Chuen",,6361,"Wah Chi Court, Wah Yuen Chuen, Kwai Tsing","22.34964,114.136"
Yau Tsim Mong,"Hoi Yan House, Hoi Fu Court",,6362,"Hoi Yan House, Hoi Fu Court, Yau Tsim Mong","22.31602,114.16491"
Wong Tai Sin,"Fu Yan House, Fu Shan Estate",,6363,"Fu Yan House, Fu Shan Estate, Wong Tai Sin","22.34274,114.20829"
Southern,"Block 3, Ocean Court",,6364,"Block 3, Ocean Court, Southern","22.24746,114.15952"
Tuen Mun,"Yiu Lun House, Siu Lun Court",,6365,"Yiu Lun House, Siu Lun Court, Tuen Mun","22.38422,113.97733"
Eastern,"Yat Wah Mansion, Lei King Wan",,6366,"Yat Wah Mansion, Lei King Wan, Eastern","22.28568,114.22418"
Wan Chai,Hung Fook Mansion,,6367,"Hung Fook Mansion, Wan Chai","22.27906,114.17914"
Wan Chai,Hung Fook Mansion,,6368,"Hung Fook Mansion, Wan Chai","22.27906,114.17914"
Yau Tsim Mong,Lee Man Building,,6369,"Lee Man Building, Yau Tsim Mong","22.32008,114.17059"
Sham Shui Po,Hung Hing Mansion,,6370,"Hung Hing Mansion, Sham Shui Po","22.33278,114.16297"
Kwai Tsing,"Hong Mei House, Cheung Hong Estate",,6371,"Hong Mei House, Cheung Hong Estate, Kwai Tsing","22.35039,114.09942"
Tuen Mun,"Hing Yiu House, Tai Hing Estate",,6372,"Hing Yiu House, Tai Hing Estate, Tuen Mun","22.40452,113.97087"
