Wan Chai,"Best Western Hotel, Causeway Bay",,6525,"Best Western Hotel, Causeway Bay, Wan Chai","22.27715,114.18069"
Sham Shui Po,Sham Shui Po Building,,6526,"Sham Shui Po Building, Sham Shui Po","22.32669,114.16216"
Wong Tai Sin,Hong Keung Court,,6527,"Hong Keung Court, Wong Tai Sin","22.33719,114.18956"
Eastern,Fong Shu Chuen Social Service Building,,6528,"Fong Shu Chuen Social Service Building, Eastern","22.27835,114.22915"
Kowloon City,"Hove Court, Perth Garden",,6529,"Hove Court, Perth Garden, Kowloon City","22.32123,114.17949"
Wan Chai,Hoi To Court,,6533,"Hoi To Court, Wan Chai","22.28166,114.18338"
Yau Tsim Mong,Skypark,,6539,"Skypark, Yau Tsim Mong","22.3191,114.17147"
Yau Tsim Mong,Skypark,,6540,"Skypark, Yau Tsim Mong","22.3191,114.17147"
Sha Tin,"Yiu Yan House, Yiu On Estate",,6541,"Yiu Yan House, Yiu On Estate, Sha Tin","22.42074,114.23137"
Sham Shui Po,Sham Shui Po Building,,6542,"Sham Shui Po Building, Sham Shui Po","22.32669,114.16216"
Wong Tai Sin,Hong Keung Court,,6543,"Hong Keung Court, Wong Tai Sin","22.33719,114.18956"
Yau Tsim Mong,Lee Man Building,,6544,"Lee Man Building, Yau Tsim Mong","22.32008,114.17059"
Sha Tin,"Yiu Yan House, Yiu On Estate",,6545,"Yiu Yan House, Yiu On Estate, Sha Tin","22.42074,114.23137"
Sha Tin,"Lung Yiu House, Kam Lung Court",,6546,"Lung Yiu House, Kam Lung Court, Sha Tin","22.42625,114.23989"
Sai Kung,"Tower 6, Le Point",,6547,"Tower 6, Le Point, Sai Kung","22.30429,114.2514"
Sha Tin,"Lung Yiu House, Kam Lung Court",,6548,"Lung Yiu House, Kam Lung Court, Sha Tin","22.42625,114.23989"
Wong Tai Sin,"Wai Yuen House (Block 10), Chuk Yuen North Estate",,6549,"Wai Yuen House (Block 10), Chuk Yuen North Estate, Wong Tai Sin","22.34581,114.19279"
Central & Western,New Central Mansion,,6550,"New Central Mansion, Central & Western","22.28387,114.1531"
Kowloon City,"Yat Man House, Ho Man Tin Estate",,6551,"Yat Man House, Ho Man Tin Estate, Kowloon City","22.31572,114.18271"
Sha Tin,"Shek Yuk House, Chun Shek Estate",,6552,"Shek Yuk House, Chun Shek Estate, Sha Tin","22.37368,114.18712"
Yau Tsim Mong,167 Fa Yuen Street,,6553,"167 Fa Yuen Street, Yau Tsim Mong","22.3227,114.17027"
Kwun Tong,"Sau Ho House, Sau Mau Ping South Estate",,6554,"Sau Ho House, Sau Mau Ping South Estate, Kwun Tong","22.31652,114.2356"
Wong Tai Sin,"Kwai Tung House, Tung Tau (II) Estate",,6555,"Kwai Tung House, Tung Tau (II) Estate, Wong Tai Sin","22.33627,114.19221"
Yau Tsim Mong,Po Hing Building,,6556,"Po Hing Building, Yau Tsim Mong","22.32615,114.16521"
Tsuen Wan,"Hoi Sing Mansion, Rivera Gardens",,6557,"Hoi Sing Mansion, Rivera Gardens, Tsuen Wan","22.36093,114.11281"
Eastern,Fong Shu Chuen Social Service Building,,6558,"Fong Shu Chuen Social Service Building, Eastern","22.27835,114.22915"
Yau Tsim Mong,Skypark,,6559,"Skypark, Yau Tsim Mong","22.3191,114.17147"
Kwun Tong,"Block A, Cheerful Court",,6560,"Block A, Cheerful Court, Kwun Tong","22.32564,114.2163"
Sai Kung,Nam Shan Village,,6562,"Nam Shan Village, Sai Kung","22.38864,114.2649"
Central & Western,Siu Cheung Building,,6563,"Siu Cheung Building, Central & Western","22.28736,114.13965"
Kowloon City,184 Kowloon City Road,,6564,"184 Kowloon City Road, Kowloon City","22.32167,114.19085"
Wong Tai Sin,"Ka Ying House (Block B), Ka Keung Court",,6565,"Ka Ying House (Block B), Ka Keung Court, Wong Tai Sin","22.34148,114.18467"
Southern,"Pik Ngan House, Shek Pai Wan Estate",,6566,"Pik Ngan House, Shek Pai Wan Estate, Southern","22.24941,114.15733"
Kowloon City,"Tower 7, Mantin Heights",,6567,"Tower 7, Mantin Heights, Kowloon City","22.31801,114.18191"
Kowloon City,"Kwai Tung House, Tung Tau (II) Estate",,6568,"Kwai Tung House, Tung Tau (II) Estate, Kowloon City","22.33627,114.19221"
Wong Tai Sin,"Yau Lung House, Choi Wan Estate",,6569,"Yau Lung House, Choi Wan Estate, Wong Tai Sin","22.33398,114.21543"
Kwun Tong,"Block 15, Laguna City",,6570,"Block 15, Laguna City, Kwun Tong","22.30629,114.22786"
Kwun Tong,"Ying Shun House, Choi Ying Estate",,6571,"Ying Shun House, Choi Ying Estate, Kwun Tong","22.32688,114.21561"
Kwun Tong,"Ko Chi House, Ko Yee Estate",,6572,"Ko Chi House, Ko Yee Estate, Kwun Tong","22.29744,114.24146"
Sha Tin,"Kam Wai House, Kam Fung Court",,6573,"Kam Wai House, Kam Fung Court, Sha Tin","22.42366,114.22568"
Wong Tai Sin,"Suet Fung House, Fung Tak Estate",,6574,"Suet Fung House, Fung Tak Estate, Wong Tai Sin","22.3446,114.19993"
Sha Tin,Shatin Wai New Village,,6575,"Shatin Wai New Village, Sha Tin","22.37503,114.17431"
Eastern,"Sui Tai House, Siu Sai Wan Estate",,6576,"Sui Tai House, Siu Sai Wan Estate, Eastern","22.26106,114.25037"
Central & Western,Leun Hing Apartments,,6577,"Leun Hing Apartments, Central & Western","22.28164,114.1279"
Tai Po,Tycoon Place,,6578,"Tycoon Place, Tai Po","22.4629,114.19782"
Islands,"Block 7, Tung Chung Cresent",,6579,"Block 7, Tung Chung Cresent, Islands","22.28884,113.93922"
Sha Tin,"Jubilee Court, Jubilee Gardens",,6580,"Jubilee Court, Jubilee Gardens, Sha Tin","22.39639,114.19975"
Yau Tsim Mong,Skypark,,6581,"Skypark, Yau Tsim Mong","22.3191,114.17147"
Yuen Long,Fung Kong Tsuen,,6582,"Fung Kong Tsuen, Yuen Long","22.45741,113.98648"
Yuen Long,"Block 4, Kenswood Court, Kingswood Villas",,6583,"Block 4, Kenswood Court, Kingswood Villas, Yuen Long","22.45969,114.00745"
Kwai Tsing,"Fu Ngo House, Tai Wo Hau Estate",,6584,"Fu Ngo House, Tai Wo Hau Estate, Kwai Tsing","22.36938,114.12507"
Southern,"Tower 29, Fung King Court, South Horizons",,6585,"Tower 29, Fung King Court, South Horizons, Southern","22.24381,114.15006"
Tuen Mun,"Oi Ming House, Yau Oi Estate",,6586,"Oi Ming House, Yau Oi Estate, Tuen Mun","22.38909,113.97328"
Sai Kung,"Tower 3, Metro Town",,6587,"Tower 3, Metro Town, Sai Kung","22.30432,114.25217"
Sha Tin,"Kam Wai House, Kam Fung Court",,6588,"Kam Wai House, Kam Fung Court, Sha Tin","22.42366,114.22568"
Central & Western,To Li Court (tower 3) Ying Ga Garden,,6589,"To Li Court (tower 3) Ying Ga Garden, Central & Western","22.28319,114.1308"
Kowloon City,"Block 4, Willow Mansions, Site 3, Whampoa Garden",,6590,"Block 4, Willow Mansions, Site 3, Whampoa Garden, Kowloon City","22.30494,114.18629"
Wan Chai,Everbright Centre (non-residential),06/11/2020,5375,"Everbright Centre (non-residential), Wan Chai","22.27898,114.17377"
Wan Chai,Everbright Centre (non-residential),06/11/2020,5384,"Everbright Centre (non-residential), Wan Chai","22.27898,114.17377"
Sha Tin,New Town Plaza Phase I Tristar Kitchen (non-residential),06/11/2020,5375,"New Town Plaza Phase I Tristar Kitchen (non-residential), Sha Tin","22.37925,114.1879"
Sha Tin,New Town Plaza Phase I Tristar Kitchen (non-residential),06/11/2020,5382,"New Town Plaza Phase I Tristar Kitchen (non-residential), Sha Tin","22.37925,114.1879"
Islands,Citygate (non-residential),06/11/2020,5388,"Citygate (non-residential), Islands","22.29114,113.94232"
Islands,Citygate (non-residential),06/11/2020,5389,"Citygate (non-residential), Islands","22.29114,113.94232"
Kowloon City,Comfort Court Tak Cheong Noodle (non-residential),07/11/2020,5367,"Comfort Court Tak Cheong Noodle (non-residential), Kowloon City","22.33041,114.18782"
Kowloon City,Comfort Court Tak Cheong Noodle (non-residential),07/11/2020,5371,"Comfort Court Tak Cheong Noodle (non-residential), Kowloon City","22.33041,114.18782"
Sha Tin,SKH Holy Spirit Primary School (non-residential),07/11/2020,5375,"SKH Holy Spirit Primary School (non-residential), Sha Tin","22.38586,114.19165"
Sha Tin,SKH Holy Spirit Primary School (non-residential),07/11/2020,5382,"SKH Holy Spirit Primary School (non-residential), Sha Tin","22.38586,114.19165"
Tsuen Wan,Tsuen Wan Plaza Super Star Chinese Cuisine (non-residential),07/11/2020,5399,"Tsuen Wan Plaza Super Star Chinese Cuisine (non-residential), Tsuen Wan","22.37396,114.11975"
Tsuen Wan,Tsuen Wan Plaza Super Star Chinese Cuisine (non-residential),07/11/2020,5444,"Tsuen Wan Plaza Super Star Chinese Cuisine (non-residential), Tsuen Wan","22.37396,114.11975"
Tuen Mun,Shan King Estate Community Recreation Building (non-residential),13/11/2020,5497,"Shan King Estate Community Recreation Building (non-residential), Tuen Mun","22.3987,113.96679"
Tuen Mun,Shan King Estate Community Recreation Building (non-residential),13/11/2020,5498,"Shan King Estate Community Recreation Building (non-residential), Tuen Mun","22.3987,113.96679"
Tuen Mun,Tai Hing Estate Commerical Complex (non-residential),14/11/2020,5497,"Tai Hing Estate Commerical Complex (non-residential), Tuen Mun","22.40288,113.97072"
Tuen Mun,Tai Hing Estate Commerical Complex (non-residential),14/11/2020,5498,"Tai Hing Estate Commerical Complex (non-residential), Tuen Mun","22.40288,113.97072"
Sha Tin,HomeSquare Jasmine (non-residential),15/11/2020,5501,"HomeSquare Jasmine (non-residential), Sha Tin","22.28056,114.15527"
Sha Tin,HomeSquare Jasmine (non-residential),15/11/2020,5505,"HomeSquare Jasmine (non-residential), Sha Tin","22.28056,114.15527"
Yau Tsim Mong,Edward Mansion Rendezvous Arts Center (non-residential),15/11/2020,5647,"Edward Mansion Rendezvous Arts Center (non-residential), Yau Tsim Mong","22.32372,114.16809"
Yau Tsim Mong,Edward Mansion Rendezvous Arts Center (non-residential),15/11/2020,5721,"Edward Mansion Rendezvous Arts Center (non-residential), Yau Tsim Mong","22.32372,114.16809"
Yau Tsim Mong,Chuang's London Plaza (non-residential),16/11/2020,5439,"Chuang's London Plaza (non-residential), Yau Tsim Mong","22.30345,114.17149"
Yau Tsim Mong,Chuang's London Plaza (non-residential),16/11/2020,5472,"Chuang's London Plaza (non-residential), Yau Tsim Mong","22.30345,114.17149"
Kowloon City,Screen World Site 8 The Whampoa ClubONE Spotlight (non-residential),16/11/2020,5638,"Screen World Site 8 The Whampoa ClubONE Spotlight (non-residential), Kowloon City","22.32307,114.19042"
Kowloon City,Screen World Site 8 The Whampoa ClubONE Spotlight (non-residential),16/11/2020,5757,"Screen World Site 8 The Whampoa ClubONE Spotlight (non-residential), Kowloon City","22.32307,114.19042"
Kowloon City,Screen World Site 8 The Whampoa ClubONE Spotlight (non-residential),16/11/2020,6064,"Screen World Site 8 The Whampoa ClubONE Spotlight (non-residential), Kowloon City","22.32307,114.19042"
Yau Tsim Mong,9 Cliff Road (non-residential),16/11/2020,6010,"9 Cliff Road (non-residential), Yau Tsim Mong","22.31071,114.17161"
North,North District Town Hall (non-residential),17/11/2020,5747,"North District Town Hall (non-residential), North","22.44278,114.01802"
North,North District Town Hall (non-residential),17/11/2020,5765,"North District Town Hall (non-residential), North","22.44278,114.01802"
Kwun Tong,Yung Fung Shee Memorial Centre (non-residential),18/11/2020,5507,"Yung Fung Shee Memorial Centre (non-residential), Kwun Tong","22.30787,114.22881"
Sai Kung,Tower 2 Twin Peaks (non-residential),18/11/2020,5509,"Tower 2 Twin Peaks (non-residential), Sai Kung","22.30446,114.26095"
Sai Kung,Tseung Kwan O Plaza (non-residential),18/11/2020,5509,"Tseung Kwan O Plaza (non-residential), Sai Kung","22.30918,114.26191"
Central & Western,9 Des Voeux Road West Heavenly Dance (non-residential),18/11/2020,5513,"9 Des Voeux Road West Heavenly Dance (non-residential), Central & Western","22.28804,114.14741"
Central & Western,9 Des Voeux Road West Heavenly Dance (non-residential),18/11/2020,5514,"9 Des Voeux Road West Heavenly Dance (non-residential), Central & Western","22.28804,114.14741"
Central & Western,9 Des Voeux Road West Heavenly Dance (non-residential),18/11/2020,5515,"9 Des Voeux Road West Heavenly Dance (non-residential), Central & Western","22.28804,114.14741"
Central & Western,9 Des Voeux Road West Heavenly Dance (non-residential),18/11/2020,5545,"9 Des Voeux Road West Heavenly Dance (non-residential), Central & Western","22.28804,114.14741"
Central & Western,9 Des Voeux Road West Heavenly Dance (non-residential),18/11/2020,5547,"9 Des Voeux Road West Heavenly Dance (non-residential), Central & Western","22.28804,114.14741"
Central & Western,9 Des Voeux Road West Heavenly Dance (non-residential),18/11/2020,5550,"9 Des Voeux Road West Heavenly Dance (non-residential), Central & Western","22.28804,114.14741"
Central & Western,9 Des Voeux Road West Heavenly Dance (non-residential),18/11/2020,5585,"9 Des Voeux Road West Heavenly Dance (non-residential), Central & Western","22.28804,114.14741"
Central & Western,9 Des Voeux Road West Heavenly Dance (non-residential),18/11/2020,5595,"9 Des Voeux Road West Heavenly Dance (non-residential), Central & Western","22.28804,114.14741"
Central & Western,9 Des Voeux Road West Heavenly Dance (non-residential),18/11/2020,5597,"9 Des Voeux Road West Heavenly Dance (non-residential), Central & Western","22.28804,114.14741"
Central & Western,9 Des Voeux Road West Heavenly Dance (non-residential),18/11/2020,5632,"9 Des Voeux Road West Heavenly Dance (non-residential), Central & Western","22.28804,114.14741"
Central & Western,9 Des Voeux Road West Heavenly Dance (non-residential),18/11/2020,5638,"9 Des Voeux Road West Heavenly Dance (non-residential), Central & Western","22.28804,114.14741"
Central & Western,9 Des Voeux Road West Heavenly Dance (non-residential),18/11/2020,5656,"9 Des Voeux Road West Heavenly Dance (non-residential), Central & Western","22.28804,114.14741"
Central & Western,9 Des Voeux Road West Heavenly Dance (non-residential),18/11/2020,5659,"9 Des Voeux Road West Heavenly Dance (non-residential), Central & Western","22.28804,114.14741"
Central & Western,9 Des Voeux Road West Heavenly Dance (non-residential),18/11/2020,5690,"9 Des Voeux Road West Heavenly Dance (non-residential), Central & Western","22.28804,114.14741"
Central & Western,9 Des Voeux Road West Heavenly Dance (non-residential),18/11/2020,5700,"9 Des Voeux Road West Heavenly Dance (non-residential), Central & Western","22.28804,114.14741"
Central & Western,9 Des Voeux Road West Heavenly Dance (non-residential),18/11/2020,5719,"9 Des Voeux Road West Heavenly Dance (non-residential), Central & Western","22.28804,114.14741"
Central & Western,9 Des Voeux Road West Heavenly Dance (non-residential),18/11/2020,5729,"9 Des Voeux Road West Heavenly Dance (non-residential), Central & Western","22.28804,114.14741"
Central & Western,9 Des Voeux Road West Heavenly Dance (non-residential),18/11/2020,5733,"9 Des Voeux Road West Heavenly Dance (non-residential), Central & Western","22.28804,114.14741"
Central & Western,9 Des Voeux Road West Heavenly Dance (non-residential),18/11/2020,5789,"9 Des Voeux Road West Heavenly Dance (non-residential), Central & Western","22.28804,114.14741"
Central & Western,9 Des Voeux Road West Heavenly Dance (non-residential),18/11/2020,5792,"9 Des Voeux Road West Heavenly Dance (non-residential), Central & Western","22.28804,114.14741"
Central & Western,9 Des Voeux Road West Heavenly Dance (non-residential),18/11/2020,5801,"9 Des Voeux Road West Heavenly Dance (non-residential), Central & Western","22.28804,114.14741"
Central & Western,9 Des Voeux Road West Heavenly Dance (non-residential),18/11/2020,5865,"9 Des Voeux Road West Heavenly Dance (non-residential), Central & Western","22.28804,114.14741"
Central & Western,9 Des Voeux Road West Heavenly Dance (non-residential),18/11/2020,5881,"9 Des Voeux Road West Heavenly Dance (non-residential), Central & Western","22.28804,114.14741"
Central & Western,9 Des Voeux Road West Heavenly Dance (non-residential),18/11/2020,5983,"9 Des Voeux Road West Heavenly Dance (non-residential), Central & Western","22.28804,114.14741"
Central & Western,9 Des Voeux Road West Heavenly Dance (non-residential),18/11/2020,6093,"9 Des Voeux Road West Heavenly Dance (non-residential), Central & Western","22.28804,114.14741"
Central & Western,9 Des Voeux Road West Heavenly Dance (non-residential),18/11/2020,6294,"9 Des Voeux Road West Heavenly Dance (non-residential), Central & Western","22.28804,114.14741"
Wan Chai,W Square Chass (non-residential),18/11/2020,5515,"W Square Chass (non-residential), Wan Chai","22.263,114.23679"
Wan Chai,W Square Chass (non-residential),18/11/2020,5548,"W Square Chass (non-residential), Wan Chai","22.263,114.23679"
Wan Chai,W Square Chass (non-residential),18/11/2020,5550,"W Square Chass (non-residential), Wan Chai","22.263,114.23679"
Wan Chai,W Square Chass (non-residential),18/11/2020,5661,"W Square Chass (non-residential), Wan Chai","22.263,114.23679"
Wan Chai,W Square Chass (non-residential),18/11/2020,5920,"W Square Chass (non-residential), Wan Chai","22.263,114.23679"
Wan Chai,14 Cannon Street Man Wah Caf (non-residential),18/11/2020,5516,"14 Cannon Street Man Wah Caf (non-residential), Wan Chai","22.28182,114.18365"
Yau Tsim Mong,Peninsula Office Tower (non-residential),18/11/2020,5517,"Peninsula Office Tower (non-residential), Yau Tsim Mong","22.29538,114.17176"
Kwai Tsing,32-40 Kwai Shing Circuit (non-residential),18/11/2020,5518,"32-40 Kwai Shing Circuit (non-residential), Kwai Tsing","22.36461,114.12839"
Sham Shui Po,315 Lai Chi Kok Road Q1 (non-residential),18/11/2020,5521,"315 Lai Chi Kok Road Q1 (non-residential), Sham Shui Po","22.32849,114.16028"
Yau Tsim Mong,Gateway Arcade Harbour City Duck Victoria (non-residential),18/11/2020,5531,"Gateway Arcade Harbour City Duck Victoria (non-residential), Yau Tsim Mong","22.29868,114.16782"
Sai Kung,The Jockey Club Kau Sai Chau Public Golf Course (non-residential),18/11/2020,5534,"The Jockey Club Kau Sai Chau Public Golf Course (non-residential), Sai Kung","22.50277,114.13275"
Yau Tsim Mong,G/F CITE 33 33 Lai Chi Kok Road (non-residential),18/11/2020,5549,"G/F CITE 33 33 Lai Chi Kok Road (non-residential), Yau Tsim Mong","22.32261,114.16782"
Yau Tsim Mong,The One AFURI Ramen + Dumpling (non-residential),18/11/2020,5552,"The One AFURI Ramen + Dumpling (non-residential), Yau Tsim Mong","22.29693,114.29337"
Yau Tsim Mong,The One Nabe Urawa (non-residential),18/11/2020,5552,"The One Nabe Urawa (non-residential), Yau Tsim Mong","22.29693,114.29337"
Kwun Tong,APM (non-residential),18/11/2020,5556,"APM (non-residential), Kwun Tong","22.31235,114.2252"
Central & Western,10 Old Peak Road (non-residential),18/11/2020,5569,"10 Old Peak Road (non-residential), Central & Western","22.27537,114.1538"
Wan Chai,World Trade Centre Myung Ga Korean Restaurant (non-residential),18/11/2020,5586,"World Trade Centre Myung Ga Korean Restaurant (non-residential), Wan Chai","22.2817,114.18409"
Yau Tsim Mong,59B Tung Choi Street Yummy (non-residential),18/11/2020,5591,"59B Tung Choi Street Yummy (non-residential), Yau Tsim Mong","22.31834,114.17059"
Central & Western,Four Seasons Hotel Hong Kong (non-residential),18/11/2020,5595,"Four Seasons Hotel Hong Kong (non-residential), Central & Western","22.28662,114.15666"
Sham Shui Po,Shek Kip Mei Park Sports Centre (non-residential),18/11/2020,5615,"Shek Kip Mei Park Sports Centre (non-residential), Sham Shui Po","22.33724,114.16999"
Southern,Aberdeen Municipal Services Building (non-residential),18/11/2020,5625,"Aberdeen Municipal Services Building (non-residential), Southern","22.2493,114.15447"
Sham Shui Po,Cheung Sha Wan Plaza Glorious Chinese Restaurant (non-residential),18/11/2020,5634,"Cheung Sha Wan Plaza Glorious Chinese Restaurant (non-residential), Sham Shui Po","22.3371,114.14867"
Sham Shui Po,CST Sky Cuisine (non-residential),18/11/2020,5634,"CST Sky Cuisine (non-residential), Sham Shui Po","22.32749,114.15242"
Yau Tsim Mong,Park Hovan Commercial Building (The World Dancer Performing Arts Federation) (non-residential),18/11/2020,5661,"Park Hovan Commercial Building (The World Dancer Performing Arts Federation) (non-residential), Yau Tsim Mong","22.30256,114.17305"
Central & Western,Alliance Building Chuen Cheung Kui Restaurant (non-residential),18/11/2020,6565,"Alliance Building Chuen Cheung Kui Restaurant (non-residential), Central & Western","22.28704,114.15192"
Central & Western,Alliance Building Chuen Cheung Kui Restaurant (non-residential),18/11/2020,6576,"Alliance Building Chuen Cheung Kui Restaurant (non-residential), Central & Western","22.28704,114.15192"
Wan Chai,25 Shan Kwong Road (non-residential),19/11/2020,5446,"25 Shan Kwong Road (non-residential), Wan Chai","22.26546,114.18675"
Wan Chai,25 Shan Kwong Road (non-residential),19/11/2020,5585,"25 Shan Kwong Road (non-residential), Wan Chai","22.26546,114.18675"
Wan Chai,25 Shan Kwong Road (non-residential),19/11/2020,5617,"25 Shan Kwong Road (non-residential), Wan Chai","22.26546,114.18675"
Wan Chai,Sunshine Plaza Starlight Dance Club (non-residential),19/11/2020,5487,"Sunshine Plaza Starlight Dance Club (non-residential), Wan Chai","22.27952,114.17886"
Wan Chai,Sunshine Plaza Starlight Dance Club (non-residential),19/11/2020,5500,"Sunshine Plaza Starlight Dance Club (non-residential), Wan Chai","22.27952,114.17886"
Wan Chai,Sunshine Plaza Starlight Dance Club (non-residential),19/11/2020,5502,"Sunshine Plaza Starlight Dance Club (non-residential), Wan Chai","22.27952,114.17886"
Wan Chai,Sunshine Plaza Starlight Dance Club (non-residential),19/11/2020,5503,"Sunshine Plaza Starlight Dance Club (non-residential), Wan Chai","22.27952,114.17886"
Wan Chai,Sunshine Plaza Starlight Dance Club (non-residential),19/11/2020,5513,"Sunshine Plaza Starlight Dance Club (non-residential), Wan Chai","22.27952,114.17886"
Wan Chai,Sunshine Plaza Starlight Dance Club (non-residential),19/11/2020,5514,"Sunshine Plaza Starlight Dance Club (non-residential), Wan Chai","22.27952,114.17886"
Wan Chai,Sunshine Plaza Starlight Dance Club (non-residential),19/11/2020,5515,"Sunshine Plaza Starlight Dance Club (non-residential), Wan Chai","22.27952,114.17886"
Wan Chai,Sunshine Plaza Starlight Dance Club (non-residential),19/11/2020,5516,"Sunshine Plaza Starlight Dance Club (non-residential), Wan Chai","22.27952,114.17886"
Wan Chai,Sunshine Plaza Starlight Dance Club (non-residential),19/11/2020,5517,"Sunshine Plaza Starlight Dance Club (non-residential), Wan Chai","22.27952,114.17886"
Wan Chai,Sunshine Plaza Starlight Dance Club (non-residential),19/11/2020,5520,"Sunshine Plaza Starlight Dance Club (non-residential), Wan Chai","22.27952,114.17886"
Wan Chai,Sunshine Plaza Starlight Dance Club (non-residential),19/11/2020,5524,"Sunshine Plaza Starlight Dance Club (non-residential), Wan Chai","22.27952,114.17886"
Wan Chai,Sunshine Plaza Starlight Dance Club (non-residential),19/11/2020,5530,"Sunshine Plaza Starlight Dance Club (non-residential), Wan Chai","22.27952,114.17886"
Wan Chai,Sunshine Plaza Starlight Dance Club (non-residential),19/11/2020,5531,"Sunshine Plaza Starlight Dance Club (non-residential), Wan Chai","22.27952,114.17886"
Wan Chai,Sunshine Plaza Starlight Dance Club (non-residential),19/11/2020,5532,"Sunshine Plaza Starlight Dance Club (non-residential), Wan Chai","22.27952,114.17886"
Wan Chai,Sunshine Plaza Starlight Dance Club (non-residential),19/11/2020,5538,"Sunshine Plaza Starlight Dance Club (non-residential), Wan Chai","22.27952,114.17886"
Wan Chai,Sunshine Plaza Starlight Dance Club (non-residential),19/11/2020,5541,"Sunshine Plaza Starlight Dance Club (non-residential), Wan Chai","22.27952,114.17886"
Wan Chai,Sunshine Plaza Starlight Dance Club (non-residential),19/11/2020,5544,"Sunshine Plaza Starlight Dance Club (non-residential), Wan Chai","22.27952,114.17886"
Wan Chai,Sunshine Plaza Starlight Dance Club (non-residential),19/11/2020,5545,"Sunshine Plaza Starlight Dance Club (non-residential), Wan Chai","22.27952,114.17886"
Wan Chai,Sunshine Plaza Starlight Dance Club (non-residential),19/11/2020,5546,"Sunshine Plaza Starlight Dance Club (non-residential), Wan Chai","22.27952,114.17886"
Wan Chai,Sunshine Plaza Starlight Dance Club (non-residential),19/11/2020,5547,"Sunshine Plaza Starlight Dance Club (non-residential), Wan Chai","22.27952,114.17886"
Wan Chai,Sunshine Plaza Starlight Dance Club (non-residential),19/11/2020,5548,"Sunshine Plaza Starlight Dance Club (non-residential), Wan Chai","22.27952,114.17886"
Wan Chai,Sunshine Plaza Starlight Dance Club (non-residential),19/11/2020,5550,"Sunshine Plaza Starlight Dance Club (non-residential), Wan Chai","22.27952,114.17886"
Wan Chai,Sunshine Plaza Starlight Dance Club (non-residential),19/11/2020,5551,"Sunshine Plaza Starlight Dance Club (non-residential), Wan Chai","22.27952,114.17886"
Wan Chai,Sunshine Plaza Starlight Dance Club (non-residential),19/11/2020,5554,"Sunshine Plaza Starlight Dance Club (non-residential), Wan Chai","22.27952,114.17886"
Wan Chai,Sunshine Plaza Starlight Dance Club (non-residential),19/11/2020,5555,"Sunshine Plaza Starlight Dance Club (non-residential), Wan Chai","22.27952,114.17886"
Wan Chai,Sunshine Plaza Starlight Dance Club (non-residential),19/11/2020,5556,"Sunshine Plaza Starlight Dance Club (non-residential), Wan Chai","22.27952,114.17886"
Wan Chai,Sunshine Plaza Starlight Dance Club (non-residential),19/11/2020,5557,"Sunshine Plaza Starlight Dance Club (non-residential), Wan Chai","22.27952,114.17886"
Wan Chai,Sunshine Plaza Starlight Dance Club (non-residential),19/11/2020,5567,"Sunshine Plaza Starlight Dance Club (non-residential), Wan Chai","22.27952,114.17886"
Wan Chai,Sunshine Plaza Starlight Dance Club (non-residential),19/11/2020,5588,"Sunshine Plaza Starlight Dance Club (non-residential), Wan Chai","22.27952,114.17886"
Wan Chai,Sunshine Plaza Starlight Dance Club (non-residential),19/11/2020,5597,"Sunshine Plaza Starlight Dance Club (non-residential), Wan Chai","22.27952,114.17886"
Wan Chai,Sunshine Plaza Starlight Dance Club (non-residential),19/11/2020,5614,"Sunshine Plaza Starlight Dance Club (non-residential), Wan Chai","22.27952,114.17886"
Wan Chai,Sunshine Plaza Starlight Dance Club (non-residential),19/11/2020,5638,"Sunshine Plaza Starlight Dance Club (non-residential), Wan Chai","22.27952,114.17886"
Wan Chai,Sunshine Plaza Starlight Dance Club (non-residential),19/11/2020,5640,"Sunshine Plaza Starlight Dance Club (non-residential), Wan Chai","22.27952,114.17886"
